user,repo,html_url,notes,description,watch,star,forks,language
nytimes,objective-c-style-guide,https://github.com/NYTimes/objective-c-style-guide,新闻室,The Objective-C Style Guide used by The New York Times,301,4035,908,
guardian,frontend,https://github.com/guardian/frontend,新闻室,Source for theguardian.com,186,3200,334,HTML
newsapps,beeswithmachineguns,https://github.com/newsapps/beeswithmachineguns,新闻室,A utility for arming (creating) many bees (micro EC2 instances) to attack (load test) targets (web applications).,147,3176,358,Python
bloombergmedia,whatiscode,https://github.com/BloombergMedia/whatiscode,新闻室,Paul Ford’s “What Is Code?”,106,2641,205,JavaScript
fivethirtyeight,data,https://github.com/fivethirtyeight/data,新闻室,Data and code behind the stories and interactives at FiveThirtyEight,548,2458,1027,Jupyter Notebook
nprapps,app-template,https://github.com/nprapps/app-template,新闻室,"The NPR visuals team's opinionated project template for client-side apps.",89,1071,155,JavaScript
voxmedia,meme,https://github.com/voxmedia/meme,新闻室,Meme generator,137,644,218,JavaScript
propublica,guides,https://github.com/propublica/guides,新闻室,"ProPublica's News App and Data Style Guides",82,440,91,HTML
timemagazine,babynames,https://github.com/TimeMagazine/babynames,新闻室,"Fun with the Social Security Administration's baby name data",28,200,50,JavaScript
censusreporter,censusreporter,https://github.com/censusreporter/censusreporter,新闻室,Census Reporter is a Knight News Challenge-funded project to make it easier for journalists to write stories using information from the U.S. Census bureau.,28,148,61,HTML
datadesk,python-elections,https://github.com/datadesk/python-elections,新闻室,"A Python wrapper for the Associated Press' U.S. election data service.",56,146,32,Python
buzzfeednews,2014-06-bikeshare-gender-maps,https://github.com/BuzzFeedNews/2014-06-bikeshare-gender-maps,新闻室,"Data and code for BuzzFeed's bikeshare gender maps.",13,54,24,Jupyter Notebook
huffpostdata,ap-election-loader,https://github.com/huffpostdata/ap-election-loader,新闻室,A Ruby library for loading election data from The Associated Press into MySQL,14,35,22,Ruby
ajam,2014_payday-nation-data,https://github.com/ajam/2014_payday-nation-data,新闻室,Data for the Payday Nation project.,10,22,8,
dukechronicle,chronline,https://github.com/dukechronicle/chronline,新闻室,The official repository for the Duke Chronicle website,28,18,1,Ruby
mbostock,d3,,图表,,,,,
nnnick,chart.js,,图表,,,,,
leaflet,leaflet,https://github.com/Leaflet/Leaflet,"图表, 地图", :leaves: JavaScript library for mobile-friendly interactive maps,724,13724,2497,JavaScript
ecomfe,echarts,https://github.com/ecomfe/echarts,图表,A powerful charting and visualization library for browser,1131,11751,4203,JavaScript
gionkunz,chartist-js,https://github.com/gionkunz/chartist-js,图表,Simple responsive charts,311,8082,1142,JavaScript
jacomyal,sigma.js,https://github.com/jacomyal/sigma.js,图表,A JavaScript library dedicated to graph drawing,299,6168,944,JavaScript
mozilla,metrics-graphics,https://github.com/mozilla/metrics-graphics,图表,"A library optimized for concise, principled data graphics and layouts.",210,5803,319,JavaScript
dc-js,dc.js,https://github.com/dc-js/dc.js,"图表,立体",Multi-Dimensional charting built to work natively with crossfilter rendered with d3.js,306,4888,1231,JavaScript
epochjs,epoch,https://github.com/epochjs/epoch,"图表,实时","A general purpose, real-time visualization library.",200,4522,250,HTML
vega,vega,https://github.com/vega/vega,图表,A visualization grammar.,259,4122,417,JavaScript
benpickles,peity,https://github.com/benpickles/peity,图表,"Progressive <svg> pie, donut, bar and line charts",129,3495,325,HTML
densitydesign,raw,https://github.com/densitydesign/raw,图表,The missing link between spreadsheets and vector graphics,261,3503,711,JavaScript
matplotlib,matplotlib,https://github.com/matplotlib/matplotlib,图表,matplotlib: plotting with Python,334,3630,1834,Python
gka,chroma.js,https://github.com/gka/chroma.js,色彩,JavaScript library for all kinds of color manipulations,113,3010,249,CoffeeScript
samizdatco,arbor,https://github.com/samizdatco/arbor,图表,a graph visualization library using web workers and jQuery,162,2225,563,JavaScript
boris-em,bemsimplelinegraph,https://github.com/Boris-Em/BEMSimpleLineGraph,"图表,移动端",Elegant Line Graphs for iOS. (Charting library),98,2132,305,Objective-C
okfn,recline,https://github.com/okfn/recline,图表,A simple but powerful library for building data applications in pure Javascript and HTML.,130,1831,302,JavaScript
humblesoftware,envisionjs,https://github.com/HumbleSoftware/envisionjs,图表,Dynamic HTML5 visualization,89,1504,244,JavaScript
kartograph,kartograph.js,https://github.com/kartograph/kartograph.js,"图表, 地图",Open source JavaScript renderer for Kartograph SVG maps,89,1401,218,JavaScript
analyticalgraphicsinc,cesium,https://github.com/AnalyticalGraphicsInc/cesium,"图表,WebGL",WebGL virtual globe and map engine,195,1273,722,JavaScript
stamen,modestmaps-js,https://github.com/stamen/modestmaps-js,"图表,地图",Modest Maps javascript port,62,525,148,JavaScript
openaddresses,openaddresses,https://github.com/openaddresses/openaddresses,"开放数据,地址",A repository of address data.,75,517,504,JavaScript
unitedstates,congress-legislators,https://github.com/unitedstates/congress-legislators,"开放数据,政治","Members of the United States Congress, 1789-Present, in YAML, as well as committees, presidents, and vice presidents.",81,412,187,Python
openexoplanetcatalogue,open_exoplanet_catalogue,https://github.com/OpenExoplanetCatalogue/open_exoplanet_catalogue,"开放数据,天文学",The Open Exoplanet Catalogue,58,300,88,Python
chicago,food-inspections-evaluation,https://github.com/Chicago/food-inspections-evaluation,"开放数据,检疫",This repository contains the code to generate predictions of critical violations at food establishments in Chicago. It also contains the results of an evaluation of the effectiveness of those predictions.,26,100,43,HTML
benbalter,congressional-districts,https://github.com/benbalter/congressional-districts,"开放数据,政治,地图","Historic and current US Congressional districts as GeoJSON, versioned within Git",12,81,21,
cernopendata,opendata.cern.ch,https://github.com/cernopendata/opendata.cern.ch,开放数据,Invenio source code overlay for CERN Open Data Portal,34,79,34,Python
newsdev,elex,https://github.com/newsdev/elex,"政治,新闻室",A wrapper for the AP v2 Elections API.,43,119,23,Python
scitools,cartopy,https://github.com/SciTools/cartopy,地图,Cartopy - a cartographic python library with matplotlib support,36,180,81,Python
coleifer,peewee,https://github.com/coleifer/peewee,数据库,"a small, expressive orm -- supports postgresql, mysql and sqlite",133,2804,494,Python
buzzfeed-openlab,rss-puppy,https://github.com/buzzfeed-openlab/rss-puppy,新闻室,A watchdog tool for monitoring RSS feeds,11,290,15,JavaScript
quartz,bad-data-guide,https://github.com/Quartz/bad-data-guide,新闻室,An exhaustive reference to problems seen in real-world data along with suggestions on how to resolve them.,141,2463,160,
jnordberg,gif.js,https://github.com/jnordberg/gif.js,GIF,JavaScript GIF encoding library,75,1887,167,JavaScript
cfpb,qu,https://github.com/cfpb/qu,政府,qu is a data platform created to serve public data sets. This is a public domain work of the US Government. ,47,194,55,Clojure
twitter,labella.js,https://github.com/twitter/labella.js,时间线,Placing labels on a timeline without overlap.,74,3322,95,JavaScript
gsa,govt-urls,https://github.com/GSA/govt-urls,政府,"Most government websites end in .gov or .mil, but many do not. Allows you to tap into USA.gov's list of government URLs that don't end in .gov or .mil.",20,27,3,Ruby
hadley,data-movies,https://github.com/hadley/data-movies,电影,Download data from IMDB movies and parse into useful form,8,73,21,Ruby
18f,open-data-maker,https://github.com/18F/open-data-maker,政府,make it easy to turn a lot of potentially large csv files into easily accessible open data,95,167,93,Ruby
developmentseed,landsat-util,https://github.com/developmentseed/landsat-util,地图,"A utility to search, download and process Landsat 8 satellite imagery",77,362,86,Python
bendc,animateplus,https://github.com/bendc/animateplus,动画,CSS and SVG animation library,77,2026,107,JavaScript
museumofmodernart,collection,https://github.com/MuseumofModernArt/collection,艺术,The Museum of Modern Art (MoMA) collection data,64,640,93,
jlevy,the-art-of-command-line,https://github.com/jlevy/the-art-of-command-line,教程,"Master the command line, in one page",1099,26460,2421,
cartodb,cartodb,https://github.com/CartoDB/cartodb,地图,Location Intelligence & Data Visualization tool,175,1138,286,JavaScript
rstudio,ggvis,https://github.com/rstudio/ggvis,R语言,Interactive grammar of graphics for R,110,535,147,R
18f,analytics-reporter,https://github.com/18F/analytics-reporter,数据分析,"Lightweight analytics reporting and publishing tool for Google Analytics data. Powers https://analytics.usa.gov, http://analytics.phila.gov, http://analytics.cityofsacramento.org, and more.",30,323,81,JavaScript
dkahle,ggmap,https://github.com/dkahle/ggmap,地图,a package for plotting maps in R with ggplot2,25,172,80,R
geolicious,qgis2leaf,https://github.com/Geolicious/qgis2leaf,"地图,QGIS",A QGIS plugin to create a working leaflet based webmap from it,25,115,29,Python
alex,what-happens-when,https://github.com/alex/what-happens-when,玩乐,"An attempt to answer the age old interview question ""What happens when you type google.com into your browser and press enter?""",544,10116,713,
hadley,rvest,https://github.com/hadley/rvest,数据抓取,Simple web scraping for R,65,563,153,R
mattboldt,typed.js,https://github.com/mattboldt/typed.js,jquery,A jQuery typing animation script.,91,2349,445,JavaScript
davidmerfield,typeset,https://github.com/davidmerfield/Typeset,字体,An html pre-proces­sor for web ty­pog­ra­phy,57,2107,45,JavaScript
edwardtufte,tufte-css,https://github.com/edwardtufte/tufte-css,CSS,Style your webpage like Edward Tufte’s handouts.,83,2371,162,HTML
tiimgreen,github-cheat-sheet,https://github.com/tiimgreen/github-cheat-sheet,教程,A list of cool features of Git and GitHub.,942,18604,2203,
newsdev,odf,https://github.com/newsdev/odf,奥林匹克,Scripts and tools to help in parsing the Olympic Data Feed from the International Olympic Committee,36,10,2,Ruby
herrbischoff,awesome-osx-command-line,https://github.com/herrbischoff/awesome-osx-command-line,教程,Use your OS X terminal shell to do awesome things.,300,7604,358,
jprobinson,newshound,https://github.com/jprobinson/newshound,新闻室,Newshound: The Breaking News Email Aggregator,3,52,7,Go
ether,etherpad-lite,https://github.com/ether/etherpad-lite,文本编辑,Etherpad: Really real-time collaborative document editing,334,5462,1235,JavaScript
quartz,chartbuilder,https://github.com/Quartz/Chartbuilder,"新闻室,图表",A front-end charting application that facilitates easy creation of simple beautiful charts,120,1803,296,JavaScript
twitter,twemoji,https://github.com/twitter/twemoji,玩乐,Twitter Emoji for Everyone,223,4797,528,JavaScript
jlord,sheetsee.js,https://github.com/jlord/sheetsee.js,图表,:eyes: :chart_with_upwards_trend: Visualize Data from a Google Spreadsheet,242,1927,384,JavaScript
arvida,emoji-cheat-sheet.com,https://github.com/arvida/emoji-cheat-sheet.com,玩乐,A one pager for emojis on Campfire and GitHub,190,3690,1026,HTML
nuknightlab,soundcite,https://github.com/NUKnightLab/soundcite,声音,Making Inline Audio Easy and Seamless,22,99,23,HTML
nytlabs,streamtools,https://github.com/nytlabs/streamtools,新闻室,tools for working with streams of data,85,1277,113,Go
nprapps,pym.js,https://github.com/nprapps/pym.js,新闻室,Resize an iframe responsively depending on the height of its content and the width of its container.,49,516,75,JavaScript
nprapps,dailygraphics,https://github.com/nprapps/dailygraphics,图表,"NPR Visuals' rig for deploying daily graphics projects in responsive iframes.",39,183,31,JavaScript
nprapps,bestpractices,https://github.com/nprapps/bestpractices,新闻室,Best practices and coding conventions for the NPR Visuals team.,41,229,28,
buzzfeednews,zika-data,https://github.com/BuzzFeedNews/zika-data,寨卡病毒,Data — and pointers to data — related to the 2015–16 Zika virus outbreak.,20,65,15,Python
pippinlee,open-journalism-project,https://github.com/pippinlee/open-journalism-project,开放数据,Resource to bring code and journalism together for fun,5,19,10,HTML
ajam,pulp,https://github.com/ajam/pulp,玩乐,A vivacious viewer for web comics.,10,81,7,JavaScript
buzzfeednews,everything,https://github.com/BuzzFeedNews/everything,新闻室,"An index of all our open-source data, analysis, libraries, tools, and guides.",30,128,11,
nytimes,nytphotoviewer,https://github.com/NYTimes/NYTPhotoViewer,新闻室,A modern photo viewing experience for iOS.,58,1502,161,Objective-C
nytimes,svg-crowbar,https://github.com/NYTimes/svg-crowbar,SVG,Extracts an SVG node and accompanying styles from an HTML document and allows you to download it all as an SVG file.,38,396,85,JavaScript
nytimes,pourover,https://github.com/NYTimes/pourover,新闻室,"A library for simple, fast filtering and sorting of large collections in the browser.   There is a community-maintained fork that addresses a handful of post-NYT issues available via @hhsnopek's https://github.com/hhsnopek/pourover",89,2403,131,JavaScript
nytimes,emphasis,https://github.com/NYTimes/Emphasis,新闻室,Dynamic Deep-Linking and Highlighting,24,554,61,JavaScript
haoyuns,eyesasia,https://github.com/haoyuns/EyesAsia,地图,"A font if you need tiny shapes for China's provinces or east Asian countries as a design element.",16,176,22,CSS
nemotyrant,manong,https://github.com/nemoTyrant/manong,资源集,码农周刊整理,500,3104,757,PLSQL
alexazhou,verynginx,https://github.com/alexazhou/VeryNginx,网络运营," A very powerful and friendly  nginx base on lua-nginx-module( openresty ) which provide WAF, Control Panel, and Dashboards. ",93,1628,200,HTML
chengyin,whatfont-bookmarklet,https://github.com/chengyin/WhatFont-Bookmarklet,字体,The core of WhatFont Tool,15,322,40,JavaScript
sofish,typo.css,https://github.com/sofish/typo.css,排版,中文网页重设与排版：一致化浏览器排版效果，构建最适合中文阅读的网页排版,142,1993,430,HTML
dropbox,zxcvbn,https://github.com/dropbox/zxcvbn,密码,A realistic password strength estimator.,173,5271,339,CoffeeScript
yahoo,gifshot,https://github.com/yahoo/gifshot,GIF,"  JavaScript library that can create animated GIFs from media streams, videos, or images",86,2481,178,JavaScript
amfe,lib-flexible,https://github.com/amfe/lib-flexible,移动端,可伸缩布局方案,261,2075,696,JavaScript
cn,cn.github.io,https://github.com/cn/cn.github.io,开放数据,CN 开放数据计划,24,23,5,CSS
qiao,pathfinding.js,https://github.com/qiao/PathFinding.js,路径,A comprehensive path-finding library for grid based games,218,4472,554,JavaScript
yyx990803,awesome,https://github.com/yyx990803/awesome,资源集,A curated list of awesome lists,1,3,2,
ecomfe,fonteditor,https://github.com/ecomfe/fonteditor,文本编辑,在线字体编辑器,35,143,40,JavaScript
jacksontian,fks,https://github.com/JacksonTian/fks,资源集,前端技能汇总 Frontend Knowledge Structure,1140,7155,2792,JavaScript
pissang,qtek,https://github.com/pissang/qtek,WebGL,WebGL graphic library,43,265,56,JavaScript
sparanoid,chinese-copywriting-guidelines,https://github.com/sparanoid/chinese-copywriting-guidelines,排版,Chinese Copywriting Guidelines / 中文文案排版指北,111,1719,240,CoffeeScript
aui,font-spider,https://github.com/aui/font-spider,字体,中文 WebFont 自动化压缩工具,99,1616,221,JavaScript
WSJ,pinpoint-editor,https://github.com/WSJ/pinpoint-editor,地图,Web app for quickly creating and editing Pinpoint maps,13,26,4,JavaScript
WSJ,cardkit-watermark,https://github.com/WSJ/cardkit-watermark,新闻室,User-friendly web app for quickly cropping and adding credits to images for social media.,27,5,1,JavaScript
WSJ,squaire,https://github.com/WSJ/squaire,地图,Javascript library to create equal-area square cartograms using d3.js,16,52,2,JavaScript
WSJ,the-meta-tag-checker,https://github.com/WSJ/the-meta-tag-checker,新闻室,Easy-to-configure social-media meta tag checker and validator.,13,11,0,PHP
dataproofer,Dataproofer,https://github.com/dataproofer/Dataproofer,数据验证,A proofreader for your data,35,409,26,JavaScript